索引号	发布机构	政策标题	发布日期	政策正文文本	政策正文附件链接
006939748/2023-00283	广东省人民政府	广东省人民政府关于中国历史文化名镇中山市黄圃镇保护规划（2019—2035年）的批复	20230629	广东省人民政府关于中国历史文化名镇中山市黄圃镇保护规划20192035年的批复粤府函202382号中山市人民政府中山市人民政府关于批准实施国家级历史文化名镇中山市黄圃镇保护规划20192035年的请示中府202285号收悉现批复如下一原则同意中国历史文化名镇中山市黄圃镇保护规划20192035年以下简称保护规划规划期限为20192035年规划范围为黄圃镇镇域辖区范围面积约8835平方公里保护范围为北至鳌兴街南至大庆路南坑路白鹤山及柳枝岗山体南缘西至镇一涌东至富东北街的围合区域面积为17137公顷其中核心保护范围包括鳌山古村和黄圃古码头遗址及古石径的范围面积约908公顷建设控制地带面积约3527公顷环境协调区面积约12702公顷二要妥善处理好历史文化名镇保护与发展的关系切实加强对黄圃镇的传统格局历史风貌空间尺度及与其相互依存的自然景观和环境的保护尤其要注重保护好鳌山古村传统空间格局及古码头古石径的海洋文化景观同时要合理利用历史文化遗存完善公共服务体系努力实现社会效益环境效益和经济效益的协调统一三加强规划实施管理确保保护规划管制措施落实到位要认真做好保护规划公布实施工作在保护范围内凡涉及历史文化遗产保护的新建改建扩建项目要严格按照中华人民共和国文物保护法历史文化名城名镇名村保护条例等有关法律法规实施避免发生破坏和影响历史文化名镇保护的建设行为要加强对历史文化名镇的保护和宣传积极营造全社会高度重视历史文化名镇保护的良好氛围省人民政府2023年6月19日	无附件链接
006939748/2023-00281	广东省人民政府	广东省人民政府关于禁止在澳门珠海水资源保障工程（水库及连通工程）占地及淹没区新增建设项目和迁入人口的通告	20230628	广东省人民政府关于禁止在澳门珠海水资源保障工程水库及连通工程占地及淹没区新增建设项目和迁入人口的通告粤府函202380号为做好澳门珠海水资源保障工程水库及连通工程建设征地补偿和移民安置工作维护有关各方合法权益保障工程建设顺利进行根据大中型水利水电工程建设征地补偿和移民安置条例国务院令第679号发布通告如下一澳门珠海水资源保障工程水库及连通工程是为确保澳门珠海城乡供水安全并为城市供水提供应急备用水源的水利工程工程由新建竹银水库二期扩建乾务水库新建白泥坑水库新建竹洲头泵站至竹银水库二期原水管道新建乾务水库至白泥坑水库连通工程新建白泥坑水库至龙井水库连通工程组成工程占地及淹没区涉及珠海市斗门区3个镇6个村白蕉镇丰洲村孖湾村乾务镇乾北村乾东村三里村斗门镇八甲村二工程占地范围包括永久建构筑物对外交通薄弱山体加高培厚和防渗水库补水连通管网等工程及其附属设施等占地范围详见附件三淹没区范围淹没区范围考虑回水影响工程调度及运行方式和安全超高等因素竹银水库二期水库淹没区为正常蓄水位494米珠基下同以下范围扩建乾务水库新增淹没区为现状运行调度水位195米与36米正常蓄水位加高1米之间范围白泥坑水库淹没区为36米正常蓄水位加高1米以下范围具体范围见附件以现场确定设置临时界桩为准四自本通告发布之日起禁止在本工程占地及淹没区内新增建设项目和迁入人口一各级人民政府及有关部门不再受理工程占地及淹没区新建扩建改建的各类建设项目的申请任何单位和个人不得在工程占地及淹没区内新建扩建改建各类建设项目二除大中专院校毕业参军复退刑满释放等回原籍落户以及新生儿随父母入户夫妻投靠迁入等国家法律法规和政策允许迁入外禁止向工程占地及淹没区迁入人口三不得改变工程占地及淹没区原土地性质及用途不得新栽种常年生经济作物和林木违反上述规定的一律不予征地补偿和人口登记安置五本通告发布后工程占地及淹没区的实物调查工作由项目法人单位按有关规定会同工程占地及淹没区所在地的地方人民政府组织实施六工程占地及淹没区内的所有单位和个人要严格执行本通告的规定积极配合有关部门开展工作对违反法律法规规定干扰实物调查和工程建设征地拆迁工作的依法追究责任七本通告施行期限自发布之日起至工程征地拆迁工作完成为止附件52450305245245034208058澳门珠海水资源保障工程水库及连通工程占地及淹没区范围示意图000000000澳门珠海水资源保障工程水库及连通工程占地及淹没区范围示意图000000省人民政府2023年6月12日	http://www.gd.gov.cn/attachment/0/524/524503/4208058.pdf
006939748/2023-00280	广东省人民政府	广东省人民政府关于禁止在广东电白抽水蓄能电站工程占地及淹没区新增建设项目和迁入人口的通告	20230628	广东省人民政府关于禁止在广东电白抽水蓄能电站工程占地及淹没区新增建设项目和迁入人口的通告粤府函202379号为做好广东电白抽水蓄能电站工程建设征地补偿和移民安置工作维护有关各方合法权益保障工程建设顺利进行根据大中型水利水电工程建设征地补偿和移民安置条例国务院令第679号发布通告如下一广东电白抽水蓄能电站工程是国家抽水蓄能中长期发展规划20212035年中的十四五重点实施项目电站枢纽工程主要由上水库下水库地下输水发电系统等组成电站装机容量1200兆瓦上水库调节库容7631万立方米下水库调节库容7543万立方米额定水头430米二工程占地和淹没区涉及茂名市电白区霞洞镇的霞洞镇社区军屯村霞洞村石顶村下中村电白区黄岭镇的下平山村工程建设占地和淹没区范围包括枢纽工程建设区上水库正常蓄水位534米以下范围下水库正常蓄水位94米加不同淹没对象安全超高及不同淹没对象对应设计洪水回水位组成的外包线以下范围永久占地面积约227247亩详见附件三自本通告发布之日起禁止在本工程占地及淹没区内新增建设项目和迁入人口一各级人民政府和有关部门不再受理工程占地及淹没区新建扩建改建的各类建设项目的申请任何单位和个人不得在工程占地及淹没区新建扩建改建各类建设项目二除大中专院校毕业参军复退刑满释放等回原籍落户新生儿随父母入户及夫妻投靠迁入等国家法律法规和政策允许迁入外禁止向工程占地及淹没区迁入人口三不得改变工程占地及淹没区原土地性质及用途不得新栽种常年生经济作物和林木违反上述规定的一律不予征地补偿和人口登记安置四本通告发布后工程占地及淹没区的实物调查工作由项目法人单位按有关规定会同工程占地及淹没区所在地的地方人民政府组织实施五工程占地及淹没区的所有单位和个人要严格执行本通告的规定积极配合有关部门开展工作对违反法律法规规定干扰实物调查和工程建设征地拆迁工作的依法追究责任六本通告施行期限自发布之日起至工程征地拆迁工作完成为止附件52449805245244984208037广东电白抽水蓄能电站工程占地及淹没区范围示意图000000000广东电白抽水蓄能电站工程占地及淹没区范围示意图000000省人民政府2023年6月11日	http://www.gd.gov.cn/attachment/0/524/524498/4208037.pdf
006939748/2023-00279	广东省人民政府	广东省人民政府关于禁止在鉴江干流治理工程占地范围新增建设项目和迁入人口的通告	20230628	广东省人民政府关于禁止在鉴江干流治理工程占地范围新增建设项目和迁入人口的通告粤府函202378号为做好鉴江干流治理工程建设征地拆迁工作维护有关各方合法权益保障工程建设顺利进行根据大中型水利水电工程建设征地补偿和移民安置条例国务院令第679号发布通告如下一鉴江干流治理工程范围涉及茂名市湛江市治理内容主要有堤防标准提升加固达标险工险段整治涵闸加固重建治理堤防总长约70公里其中茂名市境内约59公里湛江市境内约11公里新建重建或加固穿堤涵闸113座其中大型涵闸1座中型涵闸8座小型涵闸104座工程建设占地范围涉及以下2个地级市5个县市区24个镇街道的部分行政村茂名信宜市水口镇镇隆镇高州市潭头镇大井镇南塘镇曹江镇宝光街道山美街道潘州街道石鼓镇化州市丽岗镇南盛街道东山街道河西街道鉴江街道下郭街道同庆镇杨梅镇长岐镇湛江吴川市樟铺镇吴阳镇塘尾街道海滨街道坡头区乾塘镇二鉴江干流治理工程建设占地范围包括堤身加高培厚堤防防渗堤防路面护岸挡土墙和防浪墙新建重建或加固穿堤涵闸等建筑物的占地范围详见附件三自本通告发布之日起禁止在本工程占地范围新增建设项目和迁入人口一各级人民政府和有关部门不再受理工程占地范围新建扩建改建的各类建设项目申请除纳入国家及省市已批准规划的基础设施项目外任何单位和个人不得在工程占地范围新建扩建改建各类建设项目二除大中专院校毕业参军复退刑满释放等回原籍落户以及新生儿随父母入户夫妻投靠迁入等国家法律法规和政策允许迁入外禁止向工程占地范围迁入人口三不得改变工程占地范围原土地性质及用途不得新栽种常年生经济作物和林木违反上述规定的一律不予征地补偿和人口登记安置四本通告发布后工程占地范围的实物调查工作由项目法人单位按有关规定会同工程占地范围所在地的地方人民政府组织实施五工程占地范围的所有单位和个人要严格执行本通告的规定积极配合有关部门开展工作对违反法律法规规定干扰实物调查和工程建设征地拆迁工作的依法追究责任六本通告施行期限自发布之日起至工程征地拆迁工作完成为止附件52448605245244864207956鉴江干流治理工程占地范围示意图000000000鉴江干流治理工程占地范围示意图000000省人民政府2023年6月12日	http://www.gd.gov.cn/attachment/0/524/524486/4207956.pdf
006939748/2023-00278	广东省人民政府办公厅	广东省人民政府办公厅关于2023年第二季度全省政府网站与政务新媒体检查情况的通报	20230628	广东省人民政府办公厅关于2023年第二季度全省政府网站与政务新媒体检查情况的通报各地级以上市人民政府各县市区人民政府省政府各部门各直属机构为贯彻落实国务院办公厅关于印发政府网站发展指引的通知国办发201747号以下简称指引国务院办公厅秘书局关于印发政府网站与政务新媒体检查指标监管工作年度考核指标的通知国办秘函201919号以下简称检查考核指标以及省委省政府关于加强政府网站和政务新媒体管理工作的部署要求省政府办公厅组织开展了2023年第二季度政府网站与政务新媒体检查工作现将有关情况通报如下一总体情况2023年第二季度对照国务院办公厅检查考核指标省政府办公厅对全省在运行的531家政府网站进行了全覆盖检查总体合格率为989广州佛山韶关等15个地级以上市合格率均达1004月1日至6月25日全省共收到网民反馈的我为政府网站找错留言870条大多数政府网站主办单位能在1个工作日内核查处理网民反映的问题按期办结率达100同时省政府办公厅对全省正常运行的3227个政务新媒体进行了检查检查范围包括安全问题内容更新互动回应三项单项否决指标从检查结果看绝大多数政务新媒体能认真做好信息发布和互动回应工作符合检查指标要求总体合格率达998二发现的主要问题一部分政府网站运维保障工作落实不到位本季度检查发现个别网站栏目建设不规范如云浮罗定市政府门户网站多个栏目无实质性内容仅发布测试稿件造成栏目空白有的网站未建立外链地址的监测巡检机制未能在第一时间对暗链外链等不良网站进行监测预警和有效处理如东莞市深圳市龙华区政府门户网站部分网站栏目更新不及时如汕头市潮阳区梅州市蕉岭县政府门户网站均有多个动态栏目监测时间点前2周内无更新中山市政府门户网站信息发布审核把关不严导致出现严重表述错误二政务新媒体内容建设有待加强本季度检查发现部分单位政务新媒体信息发布活跃度较低或踩点更新个别单位信息发布不及时如省农业农村厅广东消费帮扶南方号多次被监测出应更新未更新揭阳市惠来县教育局微信订阅号未在全国政务新媒体信息报送系统中备案且监测时间点前2周内无更新东莞市文明大岭山湛江市湛江禁毒微信订阅号信息发布审核把关不严个别政务新媒体未做好日常巡检和监测出现失效链接如省一戒所广东省第一强戒所微信订阅号菜单栏链接无法访问三下一步工作要求一提高政治站位切实增强责任意识各地各部门要始终把政治建设摆在做好政府网站和政务新媒体工作的首要位置增强四个意识坚定四个自信做到两个维护严格落实网络意识形态工作责任制认真执行信息发布三审三校制度切实把好政治关法律关政策关保密关文字关在坚守内容安全底线的同时各政府网站和政务新媒体作为信息发布和政策解读的重要平台要聚焦我省出台的经济社会发展系列政策积极做好解读工作主动解疑释惑回应企业和群众关切为我省改革发展营造良好氛围二加强功能建设不断提升服务水平各级政府网站要按照指引有关要求适应互联网发展变化和公众使用习惯不断完善网站功能建设打造高效惠民的网上政府要规范页面展现设置在主流计算机配置和当地平均网速条件下有效优化页面加载时长提高网站页面兼容性避免出现文字错行表格错位功能和控件不可用等情况要坚持问题导向针对群众集中反映的业务系统功能不可用不好用等问题开展响应式设计推进业务系统移动端适配改造确保系统运行稳定为用户提供可用实用易用的网上办事服务三健全工作机制加强监督管理力度要高度重视政务新媒体日常运维监管工作建立健全运维监管等制度明确主体责任形成规范有序的工作格局要加强常态化监督提醒对省政府办公厅下发的典型问题立行立改举一反三并综合运用技术手段和人工检查方式自纠自查确保所有信息发布及时内容权威准确功能实用有效链接安全可用各主管单位要以完善管理制度和提升业务水平为着眼点加强政务新媒体建设管理经验做法交流互鉴认真学习先进单位工作经验同时注重发掘本地区本部门创新做法及时梳理总结并推广对此次通报存在问题的政府网站和政务新媒体有关地市和省直单位要高度重视立即采取有力措施进行整改务必见效到位并于7月20日前将整改情况报送省政府办公厅附件1各地各部门政府网站检查情况2检查发现存在突出问题的政府网站名单3各地各部门政务新媒体检查情况4检查发现存在突出问题的政务新媒体名单广东省人民政府办公厅2023年6月26日附件1各地各部门政府网站检查情况2023年第二季度108419111084108419142078881附件2检查发现存在突出问题的政府网站名单2023年第二季度108419211084108419242078882注检查采样时间为2023年4月1日至6月16日附件3各地各部门政务新媒体检查情况2023年第二季度108419311084108419342078883附件4检查发现存在突出问题的政务新媒体名单2023年第二季度108419411084108419442078884注检查采样时间为2023年4月1日至6月16日	无附件链接
